{
 "schema_version": "1.0",
 "title": "Dauth, Carta A — La breccia della Porta Sud (Giorno 3)",
 "tipo": "tattica",
 "ambiente": "abitato",
 "scale_m_per_square": 1.5,
 "map_size": [
  12,
  9
 ],
 "base_terrain": "⬜",
 "north": "N",
 "luogo": "Dauth, Porta Sud",
 "quota": "530 m ; s.l.m., l'androne della Porta Sud [INFERRED — needs DM confirmation]",
 "dislivello": "+40 m ; sul borgo dei carrettieri e sulla piana a sud, in fondo alla rampa [INFERRED — needs DM confirmation]",
 "regions": [
  {
   "terrain": "⬛",
   "rect": [
    0,
    0,
    3,
    3
   ],
   "label": "Case sulla piazzetta"
  },
  {
   "terrain": "⬛",
   "rect": [
    9,
    0,
    3,
    3
   ],
   "label": "Case sulla piazzetta"
  },
  {
   "terrain": "🏰",
   "rect": [
    0,
    6,
    4,
    2
   ],
   "label": "Mura della Porta Sud"
  },
  {
   "terrain": "🏰",
   "rect": [
    7,
    6,
    5,
    2
   ],
   "label": "Mura della Porta Sud"
  },
  {
   "terrain": "🟫",
   "rect": [
    0,
    8,
    12,
    1
   ],
   "label": "La strada fuori dalla porta"
  }
 ],
 "structures": [
  {
   "type": "🪵",
   "at": [
    4,
    7
   ],
   "label": "Battente esterno spaccato"
  },
  {
   "type": "🪵",
   "at": [
    6,
    7
   ],
   "label": "Battente esterno spaccato"
  },
  {
   "type": "🔼",
   "at": [
    0,
    5
   ],
   "label": "Scala al camminamento ovest",
   "collega": "fuori mappa ; il camminamento sopra la porta non ha una griglia: la carta lo dice solo «sui lati»"
  },
  {
   "type": "🔼",
   "at": [
    11,
    5
   ],
   "label": "Scala al camminamento est",
   "collega": "fuori mappa ; il camminamento sopra la porta non ha una griglia: la carta lo dice solo «sui lati»"
  }
 ],
 "hazards": [
  {
   "type": "🪨",
   "at": [
    3,
    5
   ],
   "label": "Macerie",
   "effect": "Terreno difficile; copertura +4 CA (la carta)"
  },
  {
   "type": "🪨",
   "at": [
    8,
    5
   ],
   "label": "Macerie",
   "effect": "Terreno difficile; copertura +4 CA (la carta)"
  },
  {
   "type": "🪨",
   "at": [
    5,
    3
   ],
   "label": "Macerie",
   "effect": "Terreno difficile; copertura +4 CA (la carta)"
  }
 ],
 "units": [
  {
   "faction": "Vanguard della Mano Rossa",
   "name": "Comandante del Vanguard (hobgoblin-captain-cr8)",
   "token": "⚫",
   "at": [
    5,
    8
   ],
   "cr": "GS 8"
  },
  {
   "faction": "Vanguard della Mano Rossa",
   "name": "Sergente hobgoblin (hobgoblin-sergente-cr5)",
   "token": "🔴",
   "at": [
    4,
    8
   ],
   "cr": "GS 5"
  },
  {
   "faction": "Vanguard della Mano Rossa",
   "name": "Sergente hobgoblin (hobgoblin-sergente-cr5)",
   "token": "🔴",
   "at": [
    6,
    8
   ],
   "cr": "GS 5"
  }
 ],
 "notes": [
  "Il varco è l'androne, 3 quadretti (E07-G08): l'imbuto della carta. La fanteria a testuggine resta sfondo, fuori dal bordo sud.",
  "Posta: tenere il varco finché i difensori lo rimurano, 3 round di lavoro, 1 se Thorik comanda i genieri. Esiti e Fronte: Carta A di DAY3-CITY-SIEGE.",
  "Fonte: Arco-Post-Hammerfist-P2B-Torneo-DAUTH-DAY3-CITY-SIEGE.md"
 ]
}
